{"fileCount":42,"fileSetDigest":"sha256:8e9c49bed6e0d09ab1439c704ffe2af4dc6fd6eda54c41c888a76fc3c4715c52","files":[{"path":"contracts/goldens/archive/index.json","sha256":"sha256:a8ba8ea4a5582aa15bf4a8ee52df481a6553e6440cfe04706452afa9b11e6ca8","size":9754},{"path":"contracts/goldens/archive/invalid/bundles/manifest-data-version-mismatch/archive-manifest.json","sha256":"sha256:b8fc4d881e906f7b8e727e174b65ce086d8323e0f2bdb8554415069bef000f9b","size":3942},{"path":"contracts/goldens/archive/invalid/bundles/manifest-data-version-mismatch/bangumi.sqlite","sha256":"sha256:0c7b1982389ec3e4358b4b1ea24252dc8f707b84459b92144d9d53e6f523fc47","size":237568},{"path":"contracts/goldens/archive/invalid/bundles/manifest-data-version-mismatch/current-pointer.json","sha256":"sha256:8b935c2107507283cec9b8e54bccb121af4184ef81447e170e9e57716fdc6dba","size":216},{"path":"contracts/goldens/archive/invalid/bundles/sqlite-corrupt/archive-manifest.json","sha256":"sha256:46f8127816b0336b0e4737abaa3ebf5331a617fcc2766c041d87823451ce7e87","size":3938},{"path":"contracts/goldens/archive/invalid/bundles/sqlite-corrupt/bangumi.sqlite","sha256":"sha256:1392877e0a2f64560ca2895c670ed7223a16900dda5091e0b8568bcfbc52ff8b","size":22},{"path":"contracts/goldens/archive/invalid/bundles/sqlite-corrupt/current-pointer.json","sha256":"sha256:d3466934757b78567ee01a8dacfa4ef19cf89ff97e39c3cc9867d774c4e7d0a0","size":216},{"path":"contracts/goldens/archive/invalid/bundles/sqlite-data-version-mismatch/archive-manifest.json","sha256":"sha256:43b2adbd77f62320f68f7cf1b2165bea854cb8f09fb242c315915a114729805a","size":3942},{"path":"contracts/goldens/archive/invalid/bundles/sqlite-data-version-mismatch/bangumi.sqlite","sha256":"sha256:22e8f585669c1c33dcc0add6b58f1199f20509bcd2a4e429eb47ebee258fcda1","size":237568},{"path":"contracts/goldens/archive/invalid/bundles/sqlite-data-version-mismatch/current-pointer.json","sha256":"sha256:730c7d79e70655e7a9ed4333c1b0303bc8c443ef8ed63c5e149b67794670a3a5","size":216},{"path":"contracts/goldens/archive/invalid/bundles/sqlite-digest-mismatch/archive-manifest.json","sha256":"sha256:68d5b5e3bcfae57334fed56b532f18ac8c8a6312e8d01cdea5bf8e3ac390285a","size":3942},{"path":"contracts/goldens/archive/invalid/bundles/sqlite-digest-mismatch/bangumi.sqlite","sha256":"sha256:6a11faa75f32ee996d423010a564f8c4fffae65e1e910b21084239e3b698eee2","size":237568},{"path":"contracts/goldens/archive/invalid/bundles/sqlite-digest-mismatch/current-pointer.json","sha256":"sha256:72f356630852aa9b8c81fac076d5bcfc707f1bb10e55a1607e5c9ee741502d00","size":216},{"path":"contracts/goldens/archive/invalid/bundles/sqlite-required-index-missing/archive-manifest.json","sha256":"sha256:3ba1b78da5195a1594a6986729031cf9fd28df98bdf3eb844d8f04a54c5f8738","size":3942},{"path":"contracts/goldens/archive/invalid/bundles/sqlite-required-index-missing/bangumi.sqlite","sha256":"sha256:6cdfe8f5530e694fa59c1a3983f2846d41e4f5dc66cc61c62550df5980aee412","size":233472},{"path":"contracts/goldens/archive/invalid/bundles/sqlite-required-index-missing/current-pointer.json","sha256":"sha256:9b99f123f901329ce235d7fd0db931cb00b98ae11691df6e7d577a3cf0ca7212","size":216},{"path":"contracts/goldens/archive/invalid/bundles/sqlite-table-count-mismatch/archive-manifest.json","sha256":"sha256:c0407fce77d900a7ac3615ae824ebddec6c0a9bf54c9312b2693a52b7ae8dc2d","size":3942},{"path":"contracts/goldens/archive/invalid/bundles/sqlite-table-count-mismatch/bangumi.sqlite","sha256":"sha256:0c7b1982389ec3e4358b4b1ea24252dc8f707b84459b92144d9d53e6f523fc47","size":237568},{"path":"contracts/goldens/archive/invalid/bundles/sqlite-table-count-mismatch/current-pointer.json","sha256":"sha256:2c3d2838cdaff6ab78b4ae9ff495ad6d34c1dae984c7aa02ca1603989f4d39cf","size":216},{"path":"contracts/goldens/archive/invalid/bundles/sqlite-unsupported-schema/archive-manifest.json","sha256":"sha256:77dac5d84d567cc5d3817efcaa4739c0110dcf1f1235e0777cf161ca7a9a23dd","size":3942},{"path":"contracts/goldens/archive/invalid/bundles/sqlite-unsupported-schema/bangumi.sqlite","sha256":"sha256:0c7b1982389ec3e4358b4b1ea24252dc8f707b84459b92144d9d53e6f523fc47","size":237568},{"path":"contracts/goldens/archive/invalid/bundles/sqlite-unsupported-schema/current-pointer.json","sha256":"sha256:62473ebcb0029700d9216976f82458ff060c5318a91828170a66f610f3fd7562","size":216},{"path":"contracts/goldens/archive/invalid/json/manifest-bad-digest.json","sha256":"sha256:e5557d405040f9e5d7d55d15668ec2301f1f046b99a276db454b49937e936f53","size":3890},{"path":"contracts/goldens/archive/invalid/json/manifest-source-accounting-mismatch.json","sha256":"sha256:ab5d911ead203d830d54b66eb24eb2d5576bd7cb18caa932a1c26a7383b6b764","size":3942},{"path":"contracts/goldens/archive/invalid/json/manifest-unknown-field.json","sha256":"sha256:c4147f500f38da8661afbb81df5ab1f4d767a132ec0edcf2b146aef229b6b8ef","size":3964},{"path":"contracts/goldens/archive/invalid/json/manifest-unsafe-sqlite-file.json","sha256":"sha256:97656c82f0d5455073f3b1bebf04ea26635283e059b1d296e51ba89afb4e4959","size":3945},{"path":"contracts/goldens/archive/invalid/json/pointer-unknown-field.json","sha256":"sha256:35024cd66b6229a03902329bffe774964d580cb48e0123cf9ddb623a12bf0a9a","size":254},{"path":"contracts/goldens/archive/invalid/json/pointer-unsafe-data-version.json","sha256":"sha256:bcb716f28bac1ada2883772571c5998b012b1a49926e05a5dc2bf822949e31fe","size":219},{"path":"contracts/goldens/archive/valid/minimal/archive-manifest.json","sha256":"sha256:68d5b5e3bcfae57334fed56b532f18ac8c8a6312e8d01cdea5bf8e3ac390285a","size":3942},{"path":"contracts/goldens/archive/valid/minimal/bangumi.sqlite","sha256":"sha256:0c7b1982389ec3e4358b4b1ea24252dc8f707b84459b92144d9d53e6f523fc47","size":237568},{"path":"contracts/goldens/archive/valid/minimal/current-pointer.json","sha256":"sha256:72f356630852aa9b8c81fac076d5bcfc707f1bb10e55a1607e5c9ee741502d00","size":216},{"path":"contracts/goldens/archive/vectors/data-version.json","sha256":"sha256:deee50089c6f84753b1f3ff82659a957146a8fa1692341d0c55d963a7c6d2ddc","size":2935},{"path":"contracts/goldens/archive/vectors/manifest-string-semantics.json","sha256":"sha256:38ec3780a19781d2c428e8014c30afdb92dc26581829a9577c3fd6ea42c18669","size":15067},{"path":"contracts/schemas/archive/archive-manifest.schema.json","sha256":"sha256:5a2b0cd7294312e9dcbdd413a1b01c4218652c4c39fd7472b74e40622e7a3e73","size":8088},{"path":"contracts/schemas/archive/compatibility-matrix.json","sha256":"sha256:7677bf83d62f38e9ac9d7af5eab2e37342a110533b63ce6f6a940d8607b84bd9","size":7033},{"path":"contracts/schemas/archive/current-pointer.schema.json","sha256":"sha256:0b1d6b7687097549bb70eebc3c592a2695e3cb5debcf2e8a9d6ba751add846e7","size":773},{"path":"contracts/schemas/archive/data-version-input.schema.json","sha256":"sha256:0b38e66fa9bf8818e8c2ea5bbc9c3b5c366e2e6d89fbcae626e8db9553223d68","size":1683},{"path":"contracts/schemas/archive/fixture-index.schema.json","sha256":"sha256:ad57d12b6160f5041946e3346a5584b968c866a4e3e3d44189c8cc618d6bc265","size":2387},{"path":"contracts/schemas/archive/schema.sql","sha256":"sha256:04fde49cb4ab9984ed20c675db850484dd2f4ec084e9ab4c219754e7033a3255","size":12863},{"path":"contracts/schemas/catalog/display-config.schema.json","sha256":"sha256:3bd85f1c30ae280290255525783520f4911adaf40bb384ddf384fcfa35242b95","size":4856},{"path":"contracts/schemas/catalog/quality-report.schema.json","sha256":"sha256:05236736735b12e646a788c506492eaf9e9da986df405c5cde4e8016f01f666d","size":4481},{"path":"contracts/schemas/catalog/staff-set-config.schema.json","sha256":"sha256:1a4ce4ae9f88c406fa59689ac9acb55a9f8a797273e05c87e7c6302b924a1ae3","size":1879}],"schemaVersion":1,"totalSize":1780175}
